"","Materia","ProbCert1a","MaxIntNuncaCert","MeanIntNuncaCert","ModeIntNuncaCert","ProbNuncaCert","MaxIntSiCert","MeanIntSiCert","ModeIntSiCert"
"1","SEMINARIO DE INVESTIGACION I","0.166666666666667","-Inf","NaN",NA,"0","6","3.6","2"
"2","LENGUAJE Y PENSAMIENTO III","0.432432432432432","5","1.38461538461538","1","0.351351351351351","5","1.75","1"
"3","SEMINARIO DE INVESTIGACION II","0.5","-Inf","NaN",NA,"0","5","3.5","3.5"
"4","CULTURA CIENTIFICA Y HUMANISTICA II","0.666666666666667","2","1.33333333333333","1","0.2","4","3.5","3.5"
"5","LENGUAJE Y PENSAMIENTO II","0.333333333333333","4","1.375","1","0.380952380952381","4","1.83333333333333","1"
"6","PARTICIPACION Y REPRESENTACION EN EL MEXICO CONTEMPORANEO","0.75","-Inf","NaN",NA,"0","4","4","4"
"7","TEORIA POLITICA III","0.666666666666667","1","1","1","0.166666666666667","4","4","4"
